"reference","title","author","year","publisher","isbn","units","source"
265,"Sikkens Cetol BL 31 cradle to gate data","Imperial College Life Cycle Assessment Group",2003,"Akzo Nobel Specialist Coatings",,,"http://people.bath.ac.uk/cj219/"
266,"Sikkens Cetol BL opaque cradle to gate data","Imperial College Life Cycle Assessment Group",2003,"Akzo Nobel Specialist Coatings",,,"http://people.bath.ac.uk/cj219/"
267,"Sikkens Cetol BL Primer cradle to gate data","Imperial College Life Cycle Assessment Group",2003,"Akzo Nobel Specialist Coatings",,,"http://people.bath.ac.uk/cj219/"
268,"Sikkens Cetol WF 955 cradle to gate date","Imperial College Life Cycle Assessment Group",2003,"Akzo Nobel Specialist Coatings",,,"http://people.bath.ac.uk/cj219/"
269,"Sikkens Cetol WP 560 cradle to gate data","Imperial College Life Cycle Assessment Group",2003,"Akzo Nobel Specialist Coatings",,,"http://people.bath.ac.uk/cj219/"
270,"Sikkens Rubbol WF 380 cradle to gate data","Imperial College Life Cycle Assessment Group",2003,"Akzo Nobel Specialist Coatings",,,"http://people.bath.ac.uk/cj219/"
271,"Solarwall, Colorcoat assessed cladding system - Environmental Product Declaration","Corus",2002,"CA Building Products",,,"http://people.bath.ac.uk/cj219/"
272,"Suspension polymerised PVC LCI Data Summary","I Boustead",1999,"APME, Association of Plastics Manufacturers in Europe",,,"http://people.bath.ac.uk/cj219/"
273,"Suspension polymerised PVC LCI Data Summary in Excel","I Boustead",1999,"APME, Association of Plastics Manufacturers in Europe",,,"http://people.bath.ac.uk/cj219/"
274,"Sustainability analysis of window frames","M Asif, T Muneer & J Kubie",2005,"Napier university",,,"http://people.bath.ac.uk/cj219/"
275,"Sustainable homes: Embodied energy in residential property development, A guide for registered social landlords.","Sustainable homes",1999,"Sustainable homes, http://www.sustainablehomes.co.uk",,,"http://people.bath.ac.uk/cj219/"
276,"Tecu, Copper Strips and Copper Alloys - Environmental Product Declaration","Institut Bauen und Umwelt -German Institute of Construction and Environment",2007,"Declaration number: AUB-KME-30807-E",,,"http://people.bath.ac.uk/cj219/"
277,"Textile floor covering (PA 6) - Environmental Product Declaration","Institut Bauen und Umwelt -German Institute of Construction and Environment",2009,"Declaration number: EPD-GUT-2009211-E",,,"http://people.bath.ac.uk/cj219/"
278,"Textile floor covering (PA 6), backing of textile fabrics - Environmental Product Declaration","Institut Bauen und Umwelt -German Institute of Construction and Environment",2009,"Declaration number: EPD-GUT-2009511-E",,,"http://people.bath.ac.uk/cj219/"
279,"Textile floor covering (PA 6.6) - Environmental Product Declaration","Institut Bauen und Umwelt -German Institute of Construction and Environment",2009,"Declaration number: EPD-GUT-2009311-E",,,"http://people.bath.ac.uk/cj219/"
280,"Textile mass balances and product life cycles; Ref S5471","British Textile Technology Group",1999,"British Textile Technology Group",,,"http://people.bath.ac.uk/cj219/"
281,"The Energy Embodied in Building Materials - updated New Zealand coefficients and their significance","George Baird, Andrew Alcorn, Phil Haslam",1997,"Centre for Building Performance Research, Victoria University of Wellington",,,"http://people.bath.ac.uk/cj219/"
282,"The environmental impacts of the production of hemp and flax textile yarn","Hayo M.G. van der Werf, Lea Turunen",2008,"industrial crops and products 2 7 ( 2 0 0 8 ) 1–10",,,"http://people.bath.ac.uk/cj219/"
283,"The European Steel Industry and Climate Change","EUROFER, European Confederation of Iron and Steel Industries",2000,"EUROFER, European Confederation of Iron and Steel Industries",,,"http://people.bath.ac.uk/cj219/"
284,"The Finnish metals industry and the environment","Jyri Seppala, Sirkka Koskela, Matti Melanen, Matti Palperi",2002,"Resources conservation and recycling (Journal), Elsevier",,,"http://people.bath.ac.uk/cj219/"
285,"The Future of the European Aluminium Industry: A MARKAL Energy and Material Flow Analysis","D J Gielen",1998,"ECN-Policy Studies",,,"http://people.bath.ac.uk/cj219/"
286,"The Life Cycle of copper, its co-products and by-products","Robert U Ayres, Leslie W Ayres and ingrid Rade",2002,"International institute for Environment and Development",,,"http://people.bath.ac.uk/cj219/"
287,"The Lifecycle assessment of Italian clay brick products","Mariachiara Torricelli",2005,"Unknown",,,"http://people.bath.ac.uk/cj219/"
288,"The measure of our sustainability, Report of the world steel industry 2004","International Iron and Steel Institute",2003,"IISI, International Iron and Steel Institute",,,"http://people.bath.ac.uk/cj219/"
289,"Thermoformed, Expanded Polystyrene  LCI Data Summary","I Boustead",2005,"APME, Association of Plastics Manufacturers in Europe",,,"http://people.bath.ac.uk/cj219/"
290,"Thermoformed, Expanded Polystyrene  LCI Data Summary in Excel format","I Boustead",2005,"APME, Association of Plastics Manufacturers in Europe",,,"http://people.bath.ac.uk/cj219/"
291,"Timber as a building material - An environmental comparison against synthetic building materials","Phil Townsend and Chris Wagner",2002,"National Association of Forest Industries Ltd",,,"http://people.bath.ac.uk/cj219/"
292,"Tonality, ceramic cladding elements - Environmental Product Declaration","Institut Bauen und Umwelt -German Institute of Construction and Environment",2009,"Declaration number: EPD-CRE-2009111-E",,,"http://people.bath.ac.uk/cj219/"
293,"Towards the holistic assessment of building performance based on an integrated systems approach","Stephane Citherlet",2001,"Swiss federal institute of technology",,,"http://people.bath.ac.uk/cj219/"
294,"Uncoated wood-free fine paper - Environmental Product Declaration","Asia Pacific Resources International Holdings Ltd.",2008,,,,"http://people.bath.ac.uk/cj219/"
295,"What LCA can tell us about the cement industry","Steven B. Young, Shannon Turnbul & Andrea Russell",2002,"Five winds international; World business council for sustainable development",,,"http://people.bath.ac.uk/cj219/"
296,"Window and advanced glazing systems life cycle assessment","Stephane Citerlet, Francesca Di Gulielmo & Jean-Bernard Gay",2000,"Energy & Buildings 32 pg 225-234",,,"http://people.bath.ac.uk/cj219/"
297,"Wood based building materials and atmospheric carbon emissions","Andrew H. Buchanan & S. Bry Levine",1999,"Environmental Science & Policy 2 (1999) 427±437",,,"http://people.bath.ac.uk/cj219/"
298,"World steel life cycle inventory - IISI methodology report","IISI - International Iron & Steel Institute",2000,"IISI - International Iron & Steel Institute",,,"http://people.bath.ac.uk/cj219/"
299,"Ytong, Autoclaved Aerated Concrete (AAC) - Environmental Product Declaration","Institut Bauen und Umwelt -German Institute of Construction and Environment",2005,"Declaration number: AUB-XEL-11005-E",,,"http://people.bath.ac.uk/cj219/"
300,"Cradle-to-Gate Carbon Footprint Analysis for Concrete Pipeline, Manhole Ring and Cover Slab","Concrete Pipeline Systems Association",2010,"Concrete Pipeline Systems Association",,,"http://people.bath.ac.uk/cj219/"
